run_id,timestamp_utc,priority,area,status,severity,gap,current_evidence,required_proof,source_report,pre_mortem_question,failure_mode,prevention,done
pre_mortem_2026-06-27_224033Z,2026-06-27_224033Z,P1,crypto_wizards_capture,pass,none,,captures=66;research_spine_ready=66;best_completeness=100.00;next_focus=ready_for_research_spine;missing=none;quality_rows=138;research_usable=47;execution_usable=30;first_quality_blocker=price_y_stale_above_90pct;missing_execution_assumptions:funding_x_bps;funding_y_bps,"pair-detail capture with spread,zscore,ecm_x,ecm_y,ecm_strength,price_x,price_y history",reports/pair_detail_capture_checklist.csv;reports/pair_detail_quality_report.csv,P1 crypto_wizards_capture: What is the most likely downside risk we are accepting by skipping this?,"Selection decisions may be based on incomplete spread/score history, producing false positives and pairs that are untradeable in practice.",Require capture completeness on spread/z-score/ECM metrics before any research promotion.,True
pre_mortem_2026-06-27_224033Z,2026-06-27_224033Z,P2,strategy_acceptance,pass,none,,steps_ready=7/7;first_blocker=none,production-eligible strategy with required two-leg base/stress results across multiple pairs,reports/strategy_acceptance_checklist.csv;reports/research_unblock_plan.csv,P2 strategy_acceptance: What is the most likely downside risk we are accepting by skipping this?,A strategy might appear good in dashboards but be rejected by production-style gates after deployment.,Keep strategy acceptance gates as mandatory before moving any pair into execution lanes.,True
pre_mortem_2026-06-27_224033Z,2026-06-27_224033Z,P3,dydx_testnet_readiness,gap,high,submit_orders_false,steps_ready=5/7;first_blocker=submit_orders_false,"submit flag, credentials, SDK, indexer, and authenticated order adapter all ready",reports/dydx_execution_checklist.csv,P3 dydx_testnet_readiness: What would fail and what signal would we watch first?,Paper/live requests can fail at submit time and silently degrade into partial or dropped hedges.,Keep all venue execution checks and adapter wiring as hard blockers before paper/live signals.,False
pre_mortem_2026-06-27_224033Z,2026-06-27_224033Z,P4,paper_execution_gate,gap,high,strategy_or_dydx_gate_not_ready,steps_ready=1/4;first_blocker=submit_orders_false,strategy_acceptance ready and dydx_testnet_readiness ready,reports/paper_execution_preflight.csv,P4 paper_execution_gate: What would fail and what signal would we watch first?,Paper gating might pass with assumptions that do not hold in real or execution-tied backtests.,Run paper preflight as a strict step with explicit block reasons and no override path.,False
pre_mortem_2026-06-27_224033Z,2026-06-27_224033Z,P5,learning_event_store,pass,none,,events=100;outcomes=100;outcomes_remaining=0;ready_for_modeling=True,paper journal or trade store contains outcome events for later modeling,reports/learning_event_summary.csv,P5 learning_event_store: What is the most likely downside risk we are accepting by skipping this?,No realized outcomes means no feedback loop; model quality and execution bias drift undetected.,Collect learning outcomes before model score updates and prevent model retraining on missing labels.,True
