run_id,timestamp_utc,priority,area,status,severity,gap,current_evidence,required_proof,source_report,incident_observed,trajectory,post_mortem_insight,prevention_from_pre_mortem,done
post_mortem_2026-06-27_223845Z,2026-06-27_223845Z,P1,crypto_wizards_capture,pass,none,,captures=66;research_spine_ready=66;best_completeness=100.00;next_focus=ready_for_research_spine;missing=none;quality_rows=138;research_usable=47;execution_usable=30;first_quality_blocker=price_y_stale_above_90pct;missing_execution_assumptions:funding_x_bps;funding_y_bps,"pair-detail capture with spread,zscore,ecm_x,ecm_y,ecm_strength,price_x,price_y history",reports/pair_detail_capture_checklist.csv;reports/pair_detail_quality_report.csv,We likely selected a candidate on stale or incomplete pair-structure data and entered with misleading spread/z-score/ECM signal quality.,unknown,No recent trajectory comparison data was available; treat this as first-observed post-run evidence.,Require capture completeness on spread/z-score/ECM metrics before any research promotion.,True
post_mortem_2026-06-27_223845Z,2026-06-27_223845Z,P2,strategy_acceptance,pass,none,,steps_ready=7/7;first_blocker=none,production-eligible strategy with required two-leg base/stress results across multiple pairs,reports/strategy_acceptance_checklist.csv;reports/research_unblock_plan.csv,A strategy likely performed in simulation but failed production-grade constraints not met in earlier runs.,unknown,No recent trajectory comparison data was available; treat this as first-observed post-run evidence.,Keep strategy acceptance gates as mandatory before moving any pair into execution lanes.,True
post_mortem_2026-06-27_223845Z,2026-06-27_223845Z,P3,dydx_testnet_readiness,gap,high,submit_orders_false;missing_wallet_address;missing_private_key;missing_dydx_order_client_adapter,steps_ready=3/7;first_blocker=missing_wallet_address;missing_private_key,"submit flag, credentials, SDK, indexer, and authenticated order adapter all ready",reports/dydx_execution_checklist.csv,Order submission path likely failed or dropped in paper/live paths.,new,"dydx_testnet_readiness is actionable to investigate now; evidence is available (`steps_ready=3/7;first_blocker=missing_wallet_address;missing_private_key`), so a concrete regression cause can be logged.",Keep all venue execution checks and adapter wiring as hard blockers before paper/live signals.,False
post_mortem_2026-06-27_223845Z,2026-06-27_223845Z,P4,paper_execution_gate,gap,high,strategy_or_dydx_gate_not_ready,steps_ready=3/4;first_blocker=missing_paper_trading_journal,strategy_acceptance ready and dydx_testnet_readiness ready,reports/paper_execution_preflight.csv,Paper validation became out of sync with actual execution readiness and generated false-positive acceptance.,new,"paper_execution_gate is actionable to investigate now; evidence is available (`steps_ready=3/4;first_blocker=missing_paper_trading_journal`), so a concrete regression cause can be logged.",Run paper preflight as a strict step with explicit block reasons and no override path.,False
post_mortem_2026-06-27_223845Z,2026-06-27_223845Z,P5,learning_event_store,pass,none,,events=100;outcomes=100;outcomes_remaining=0;ready_for_modeling=True,paper journal or trade store contains outcome events for later modeling,reports/learning_event_summary.csv,No realized outcomes blocked learning feedback; weak or unsafe settings were not corrected in time.,unknown,No recent trajectory comparison data was available; treat this as first-observed post-run evidence.,Collect learning outcomes before model score updates and prevent model retraining on missing labels.,True
